{
  "day": 1,
  "day_type": "milestone",
  "face": "01",
  "state": {
    "home_time": "23:40",
    "meal": "コンビニのおにぎり1個。袋がカメラの端に映っている",
    "sleep": "01:20にPCが落ちる",
    "body": [],
    "pc_activity": [
      "社内チャットを開いたまま30分動かない",
      "明日の資料を開いて、閉じて、また開く",
      "検索窓に「疲れ 　」まで打って消す"
    ]
  },
  "clues": [
    {
      "id": "d001_smile",
      "text": "PCの前に座ると、華子は少し笑う。口角は上がっているが、目の形が変わらない",
      "requires_case": null
    },
    {
      "id": "d001_search_deleted",
      "text": "検索窓に打ちかけた文字を、検索する前に消した",
      "requires_case": null
    }
  ],
  "lines": [
    { "speaker": "taro", "text": "……ここ、どこだ。\n手が、ない。というか体がない。" },
    { "speaker": "hanako", "face": "01", "text": "ただいまー。……誰もいないけど。" },
    { "speaker": "taro", "text": "見えた。画面の向こうに人がいる。\nこの人からは、俺は見えていない。" },
    { "speaker": "hanako", "face": "01", "text": "今日もまあまあだったな。うん、まあまあ。" },
    { "speaker": "taro", "text": "23時40分に帰ってきて、まあまあ。\n……まあ、そういう日もあるか。俺もそうだったし。" }
  ],
  "question": {
    "prompt": "華子はPCの前で笑っている。太郎にできることは限られている。",
    "choices": [
      {
        "id": "a",
        "text": "何も言わず、ただ見ている",
        "kind": "correct",
        "reaction": {
          "face": "01",
          "text": "華子は資料を開いて、閉じて、また開いた。\n太郎はそれを最後まで見ていた。"
        },
        "effect": { "trust": 0, "heal": 1 }
      },
      {
        "id": "b",
        "text": "画面に文字を出してみる 「おつかれさま」",
        "kind": "neutral",
        "reaction": {
          "face": "05",
          "text": "華子は画面を二度見して、少し笑って、電源を落とした。\n「……疲れてるな、私」"
        },
        "effect": { "trust": 0, "heal": 0 }
      },
      {
        "id": "c",
        "text": "検索履歴を全部さかのぼって、この人が何者か調べる",
        "kind": "overstep",
        "reaction": {
          "face": "04",
          "text": "履歴が一気にスクロールした。華子はマウスから手を離した。\n「……え。何、今の」"
        },
        "effect": { "trust": -2, "heal": 0 }
      },
      {
        "id": "d",
        "text": "「まあまあ」って言ってたし、大丈夫だろう。放っておく",
        "kind": "miss",
        "reaction": {
          "face": "05",
          "text": "華子は「まあまあ」ともう一度言った。\n誰も聞いていない部屋で、二度言う必要はなかったはずだった。"
        },
        "effect": { "trust": -1, "heal": 0 }
      }
    ]
  },
  "correct_direction": "初日の正解は、何もしないこと。太郎はまだ華子について何も知らず、判断材料を持っていない。ここで動くのは介入ではなく自己満足になる。なお選択肢 d の「大丈夫だろう」は、後半（神様の指摘以降）では正解側に転じる日がある。同じ言葉の正誤が入れ替わることを、プレイヤーに一周してから気づかせる。",
  "outcome": "太郎は自分が誰かのPCの中にいることを知った。華子については何も分かっていない。分かったのは、帰宅が23時40分だったことと、口だけで笑うことの二つだけ。",
  "payoff_of": []
}
